{
  "schema_version": "1.0",
  "message_id": "55555555-5555-4555-8555-555555555555",
  "command_id": "55555555-5555-4555-8555-555555555555",
  "job_id": "33333333-3333-4333-8333-333333333333",
  "execution_fence": 1,
  "owner_deletion_epoch": 0,
  "issued_at": "2026-09-16T02:00:00Z",
  "payload_ref": "66666666-6666-4666-8666-666666666666"
}
